{
  "repo": "andyai-second-brain",
  "pack": "PACK10",
  "final_tag": "v20.0.0",
  "build_verify_result": "passed",
  "push_result": "not-run-local-first",
  "final_alignment": "clean-tree-pending-final-check",
  "semafor": {
    "green": 25,
    "yellow": 0,
    "red": 0
  },
  "timing": {
  "started": "2026-05-16T23:25:58Z",
  "finished": "2026-05-16T23:26:02Z",
  "total_ms": 3289,
  "versions_completed": 7,
  "average_phase_ms": 469,
  "slowest_phase": {"version": "v18.6.0", "title": "Repo Registry Writer", "ms": 451},
  "fastest_phase": {"version": "v18.5.0", "title": "Bridge Hub Runtime CLI", "ms": 259},
  "estimated_next_20_version_pack_ms": 9380
}
}
